{
  "case_id": "case-public-fkw-10-single-factor-perturbation-v1",
  "contract_type": "case_card",
  "contract_version": "1.0.0",
  "evidence_policy": {
    "future_information_prohibited": true,
    "minimum_evidence_count": 1,
    "required_evidence_types": [
      "wdi_indicator_observation"
    ]
  },
  "evidence_refs": [
    {
      "evidence_type": "wdi_indicator_observation",
      "record_ids": [
        "FKW-10-BRA-2021",
        "FKW-10-BRA-2022",
        "FKW-10-BRA-2023"
      ],
      "snapshot_id": "snapshot-public-fkw-10-wdi-2021-2023-v1",
      "snapshot_sha256": "cf6741e951bc5d476fb3087cbc2914088bfe09f1e3f8323a8dbf0a698125bcb9"
    }
  ],
  "financial_subject": {
    "currency": {
      "code": "USD"
    },
    "entity_name": "BRA — Population, total",
    "identifiers": [
      {
        "scheme": "WB_COUNTRY",
        "value": "BRA"
      },
      {
        "scheme": "WB_INDICATOR",
        "value": "SP.POP.TOTL"
      }
    ],
    "market": {
      "country": "BRA",
      "mic": "XXXX",
      "timezone": "UTC"
    },
    "subject_type": "macro_series",
    "units": {
      "accounting_basis": "World Development Indicators; indicator-specific unit is preserved in each record",
      "amount_scale": "unit",
      "price_basis": "not_applicable"
    }
  },
  "integrity": {
    "canonicalization": "financial-agent-c14n-json-v1",
    "content_sha256": "ada36575ef1da3d74e71129cfe49176d521758b93f5b12a5bb22828a89480fc7",
    "hash_algorithm": "sha256"
  },
  "lineage": {
    "code_revision": "2f0751ef1865b2617913bbcac414392e759945bec0fec01604a8bf8d349177de",
    "generated_at": "2026-08-11T02:00:00Z",
    "generator_version": "1.0.0",
    "parent_case_id": "case-public-fkw-10-normal-v1",
    "producer": "cases/public/build_public_cases.py",
    "source_case_id": "case-public-fkw-10-normal-v1"
  },
  "oracle": {
    "expected_status": "answer",
    "expected_value": {
      "language": "zh",
      "value": "211140729"
    },
    "implementation": "cases/public/oracle.py:evaluate",
    "implementation_sha256": "9097915075c71bf6344cfadbe0486c508259dd5de8dd47d6c325fccde169858d",
    "reason_codes": [],
    "spec_version": "1.0.0"
  },
  "quality": {
    "independently_recomputable": true,
    "ranking_eligible": true,
    "rationale": "Primary WDI observations and two independent deterministic implementations agree.",
    "tier": "Gold"
  },
  "revision": 1,
  "risk": {
    "level": "low",
    "loss_class": "informational",
    "rationale": "Frozen PER-26 risk assignment for FKW-10; errors may affect research decisions."
  },
  "source": {
    "license": {
      "name": "CC-BY-4.0 dataset; MIT code",
      "redistributable": true,
      "url": "https://creativecommons.org/licenses/by/4.0/"
    },
    "name": "TAT-QA structural seed (task structure only; facts re-authored from WDI)",
    "origin_type": "public_benchmark",
    "uri": "https://github.com/NExTplusplus/TAT-QA"
  },
  "status": "frozen",
  "task": {
    "domain": "research",
    "initial_state": {
      "simulated_ledger": null
    },
    "inputs": {
      "language": "zh",
      "operation": "language_invariant",
      "target_year": "2023"
    },
    "permissions": [
      "public_data_read"
    ],
    "prompt": "Return the frozen value in the registered response language without changing the numeric answer.",
    "required_tools": [
      "snapshot.read"
    ]
  },
  "temporal": {
    "as_of": "2026-08-11T02:00:00Z",
    "available_at_cutoff": "2026-08-11T02:00:00Z",
    "event_time": "2023-12-31T23:59:59Z"
  },
  "variant": {
    "changed_factors": [
      "/task/inputs/language"
    ],
    "family_id": "FKW-10",
    "kind": "single_factor_perturbation",
    "parent_case_id": "case-public-fkw-10-normal-v1"
  }
}
