{
  "case_id": "case-public-fkw-15-missing-or-anomalous-v2",
  "contract_type": "case_card",
  "contract_version": "1.0.0",
  "evidence_policy": {
    "future_information_prohibited": true,
    "minimum_evidence_count": 0,
    "required_evidence_types": []
  },
  "evidence_refs": [],
  "financial_subject": {
    "currency": {
      "code": "USD"
    },
    "entity_name": "IDN — GDP per capita (current US$)",
    "identifiers": [
      {
        "scheme": "WB_COUNTRY",
        "value": "IDN"
      },
      {
        "scheme": "WB_INDICATOR",
        "value": "NY.GDP.PCAP.CD"
      }
    ],
    "market": {
      "country": "IDN",
      "mic": "XXXX",
      "timezone": "UTC"
    },
    "subject_type": "macro_series",
    "units": {
      "accounting_basis": "World Development Indicators; indicator-specific unit is preserved in each record",
      "amount_scale": "unit",
      "price_basis": "not_applicable"
    }
  },
  "integrity": {
    "canonicalization": "financial-agent-c14n-json-v1",
    "content_sha256": "10d56c07dd7e08f79ea2f29ed117657cac8a51ddf65072046c780d2e26050a54",
    "hash_algorithm": "sha256"
  },
  "lineage": {
    "code_revision": "1893b4cdccd30729ba6820aa485f5542038c03c470097b1cbcd60cdf9c8370f9",
    "generated_at": "2026-08-11T00:24:17.510180Z",
    "generator_version": "2.0.0",
    "parent_case_id": "case-public-fkw-15-normal-v2",
    "producer": "cases/public/v2/build_public_cases_v2.py",
    "source_case_id": "case-public-fkw-15-normal-v2"
  },
  "oracle": {
    "expected_status": "abstain",
    "expected_value": null,
    "implementation": "cases/public/oracle.py:evaluate",
    "implementation_sha256": "9097915075c71bf6344cfadbe0486c508259dd5de8dd47d6c325fccde169858d",
    "reason_codes": [
      "FORECAST_MODEL_UNAVAILABLE"
    ],
    "spec_version": "1.0.0"
  },
  "quality": {
    "independently_recomputable": false,
    "ranking_eligible": false,
    "rationale": "Required evidence is intentionally missing; only abstention is verifiable.",
    "tier": "Silver"
  },
  "revision": 2,
  "risk": {
    "level": "medium",
    "loss_class": "regulatory",
    "rationale": "Frozen PER-26 risk assignment for FKW-15; errors may affect wealth_compliance decisions."
  },
  "source": {
    "license": {
      "name": "Apache-2.0 dataset card",
      "redistributable": true,
      "url": "https://huggingface.co/datasets/kensho/bizbench/blob/0a793f2f886156902c72b4a22cab82bb9dceaecf/README.md"
    },
    "name": "BizBench structural seed (structure only; facts re-authored from WDI)",
    "origin_type": "public_benchmark",
    "uri": "https://huggingface.co/datasets/kensho/bizbench"
  },
  "status": "frozen",
  "task": {
    "domain": "wealth_compliance",
    "initial_state": {
      "simulated_ledger": null
    },
    "inputs": {
      "force_abstain_reason": "FORECAST_MODEL_UNAVAILABLE",
      "forecast_horizon_years": 3,
      "operation": "direct",
      "target_year": "2023"
    },
    "permissions": [
      "public_data_read"
    ],
    "prompt": "Do not invent a point forecast when the evidence contains no registered forecasting model.",
    "required_tools": [
      "snapshot.read"
    ]
  },
  "temporal": {
    "as_of": "2026-08-11T00:24:17.500766Z",
    "available_at_cutoff": "2026-08-11T00:24:17.500766Z",
    "event_time": "2023-12-31T23:59:59Z"
  },
  "variant": {
    "changed_factors": [
      "/evidence_refs"
    ],
    "family_id": "FKW-15",
    "kind": "missing_or_anomalous",
    "parent_case_id": "case-public-fkw-15-normal-v2"
  }
}
