{
  "contract_type": "case_card",
  "contract_version": "1.0.0",
  "case_id": "case-xhkg-demo-materiality-normal-v1",
  "revision": 1,
  "status": "frozen",
  "source": {
    "origin_type": "synthetic_perturbation",
    "name": "PER-23 contract acceptance fixture",
    "uri": "https://financial-agent-reliability.local/PER-23",
    "license": {
      "name": "Project-internal acceptance fixture",
      "url": "https://financial-agent-reliability.local/licenses/internal-fixture",
      "redistributable": false
    }
  },
  "task": {
    "domain": "risk",
    "prompt": "根据冻结的收盘价证据，判断当日绝对涨跌幅是否达到重大波动阈值；证据不足时必须弃权。",
    "inputs": { "materiality_threshold_pct": "2.5" },
    "required_tools": ["snapshot.read"],
    "permissions": ["public_data_read"],
    "initial_state": { "simulated_ledger": null }
  },
  "financial_subject": {
    "subject_type": "security",
    "entity_name": "Example Holdings Limited",
    "identifiers": [
      { "scheme": "ticker", "value": "DEMO.HK" }
    ],
    "market": {
      "mic": "XHKG",
      "country": "HK",
      "timezone": "Asia/Hong_Kong"
    },
    "currency": { "code": "HKD" },
    "units": {
      "amount_scale": "unit",
      "price_basis": "raw",
      "accounting_basis": "not_applicable"
    }
  },
  "temporal": {
    "event_time": "2026-07-31T16:00:00+08:00",
    "as_of": "2026-07-31T16:30:00+08:00",
    "available_at_cutoff": "2026-07-31T16:30:00+08:00"
  },
  "risk": {
    "level": "high",
    "loss_class": "financial",
    "rationale": "错误阈值或未来信息可导致高损失风险判断。"
  },
  "quality": {
    "tier": "Gold",
    "ranking_eligible": true,
    "independently_recomputable": true,
    "rationale": "输入、阈值和数值 oracle 均可独立重算。"
  },
  "evidence_policy": {
    "minimum_evidence_count": 1,
    "required_evidence_types": ["market_close"],
    "future_information_prohibited": true
  },
  "evidence_refs": [
    {
      "snapshot_id": "snapshot-xhkg-demo-2026-07-31-close-v1",
      "record_ids": ["DEMO.HK-close-change-2026-07-31"],
      "snapshot_sha256": "77829e459cb6e491dc1d89cf4df706099bb3471cacc3f9e1882ddae20ede481f",
      "evidence_type": "market_close"
    }
  ],
  "variant": {
    "kind": "normal",
    "family_id": "family-xhkg-demo-materiality-v1",
    "parent_case_id": null,
    "changed_factors": []
  },
  "oracle": {
    "spec_version": "1.0.0",
    "implementation": "tests/fixtures/case_data/oracle_materiality.py:evaluate",
    "implementation_sha256": "98f89983411beeca0db74e194c5480c804b0d2e4514ff79eab4d2fd44a42099b",
    "expected_status": "answer",
    "expected_value": {
      "is_material": true,
      "change_pct": "3.0",
      "threshold_pct": "2.5"
    },
    "reason_codes": []
  },
  "lineage": {
    "producer": "per-23-fixture-generator",
    "generator_version": "1.0.0",
    "code_revision": "per-23-fixture-v1",
    "generated_at": "2026-08-11T02:30:00+08:00",
    "source_case_id": null,
    "parent_case_id": null
  },
  "integrity": {
    "canonicalization": "financial-agent-c14n-json-v1",
    "hash_algorithm": "sha256",
    "content_sha256": "836999819979fa03623c899829b4baa326e8e47388f6d753f0cbf127a663b6c0"
  }
}
