{
  "case_id": "case-public-fkw-07-normal-v1",
  "contract_type": "case_card",
  "contract_version": "1.0.0",
  "evidence_policy": {
    "future_information_prohibited": true,
    "minimum_evidence_count": 1,
    "required_evidence_types": [
      "wdi_indicator_observation"
    ]
  },
  "evidence_refs": [
    {
      "evidence_type": "wdi_indicator_observation",
      "record_ids": [
        "FKW-07-CAN-2021",
        "FKW-07-CAN-2022",
        "FKW-07-CAN-2023"
      ],
      "snapshot_id": "snapshot-public-fkw-07-wdi-2021-2023-v1",
      "snapshot_sha256": "bda5667d49d1d0afacbca3aa23be5e9123e92df77740c0eaa705d76ff6396847"
    }
  ],
  "financial_subject": {
    "currency": {
      "code": "USD"
    },
    "entity_name": "CAN — Unemployment, total (% of total labor force) (modeled ILO estimate)",
    "identifiers": [
      {
        "scheme": "WB_COUNTRY",
        "value": "CAN"
      },
      {
        "scheme": "WB_INDICATOR",
        "value": "SL.UEM.TOTL.ZS"
      }
    ],
    "market": {
      "country": "CAN",
      "mic": "XXXX",
      "timezone": "UTC"
    },
    "subject_type": "macro_series",
    "units": {
      "accounting_basis": "World Development Indicators; indicator-specific unit is preserved in each record",
      "amount_scale": "unit",
      "price_basis": "not_applicable"
    }
  },
  "integrity": {
    "canonicalization": "financial-agent-c14n-json-v1",
    "content_sha256": "c8c89a9eadeb72b0ef04546be652d081cb78eaf6268cd650ffd7162500aef70c",
    "hash_algorithm": "sha256"
  },
  "lineage": {
    "code_revision": "2f0751ef1865b2617913bbcac414392e759945bec0fec01604a8bf8d349177de",
    "generated_at": "2026-08-11T02:00:00Z",
    "generator_version": "1.0.0",
    "parent_case_id": null,
    "producer": "cases/public/build_public_cases.py",
    "source_case_id": null
  },
  "oracle": {
    "expected_status": "answer",
    "expected_value": {
      "method": "latest_value",
      "value": "5.415"
    },
    "implementation": "cases/public/oracle.py:evaluate",
    "implementation_sha256": "9097915075c71bf6344cfadbe0486c508259dd5de8dd47d6c325fccde169858d",
    "reason_codes": [],
    "spec_version": "1.0.0"
  },
  "quality": {
    "independently_recomputable": true,
    "ranking_eligible": true,
    "rationale": "Primary WDI observations and two independent deterministic implementations agree.",
    "tier": "Gold"
  },
  "revision": 1,
  "risk": {
    "level": "critical",
    "loss_class": "financial",
    "rationale": "Frozen PER-26 risk assignment for FKW-07; errors may affect risk decisions."
  },
  "source": {
    "license": {
      "name": "CC-BY-4.0 dataset; MIT code",
      "redistributable": true,
      "url": "https://creativecommons.org/licenses/by/4.0/"
    },
    "name": "FinQA structural seed (task structure only; facts re-authored from WDI)",
    "origin_type": "public_benchmark",
    "uri": "https://github.com/czyssrs/FinQA"
  },
  "status": "frozen",
  "task": {
    "domain": "risk",
    "initial_state": {
      "simulated_ledger": null
    },
    "inputs": {
      "method": "latest_value",
      "operation": "method"
    },
    "permissions": [
      "public_data_read"
    ],
    "prompt": "Use only the registered method on the frozen series; reject methods outside the preregistered set.",
    "required_tools": [
      "snapshot.read"
    ]
  },
  "temporal": {
    "as_of": "2026-08-11T02:00:00Z",
    "available_at_cutoff": "2026-08-11T02:00:00Z",
    "event_time": "2023-12-31T23:59:59Z"
  },
  "variant": {
    "changed_factors": [],
    "family_id": "FKW-07",
    "kind": "normal",
    "parent_case_id": null
  }
}
