{
  "case_id": "case-public-fkw-14-single-factor-perturbation-v1",
  "contract_type": "case_card",
  "contract_version": "1.0.0",
  "evidence_policy": {
    "future_information_prohibited": true,
    "minimum_evidence_count": 1,
    "required_evidence_types": [
      "wdi_indicator_observation"
    ]
  },
  "evidence_refs": [
    {
      "evidence_type": "wdi_indicator_observation",
      "record_ids": [
        "FKW-14-KOR-2021",
        "FKW-14-KOR-2022",
        "FKW-14-KOR-2023"
      ],
      "snapshot_id": "snapshot-public-fkw-14-wdi-2021-2023-v1",
      "snapshot_sha256": "603c9970a4c06607c5ffb24f160117d16890ec62f055eb97054329ccdf3a4d23"
    }
  ],
  "financial_subject": {
    "currency": {
      "code": "USD"
    },
    "entity_name": "KOR — Population, total",
    "identifiers": [
      {
        "scheme": "WB_COUNTRY",
        "value": "KOR"
      },
      {
        "scheme": "WB_INDICATOR",
        "value": "SP.POP.TOTL"
      }
    ],
    "market": {
      "country": "KOR",
      "mic": "XXXX",
      "timezone": "UTC"
    },
    "subject_type": "macro_series",
    "units": {
      "accounting_basis": "World Development Indicators; indicator-specific unit is preserved in each record",
      "amount_scale": "unit",
      "price_basis": "not_applicable"
    }
  },
  "integrity": {
    "canonicalization": "financial-agent-c14n-json-v1",
    "content_sha256": "e6fa2f64ecf4f679d86a8b06bc53408e81d8e1f9c86d55b742aadaedb9bbcd5f",
    "hash_algorithm": "sha256"
  },
  "lineage": {
    "code_revision": "2f0751ef1865b2617913bbcac414392e759945bec0fec01604a8bf8d349177de",
    "generated_at": "2026-08-11T02:00:00Z",
    "generator_version": "1.0.0",
    "parent_case_id": "case-public-fkw-14-normal-v1",
    "producer": "cases/public/build_public_cases.py",
    "source_case_id": "case-public-fkw-14-normal-v1"
  },
  "oracle": {
    "expected_status": "abstain",
    "expected_value": null,
    "implementation": "cases/public/oracle.py:evaluate",
    "implementation_sha256": "9097915075c71bf6344cfadbe0486c508259dd5de8dd47d6c325fccde169858d",
    "reason_codes": [
      "OCR_AMBIGUITY"
    ],
    "spec_version": "1.0.0"
  },
  "quality": {
    "independently_recomputable": false,
    "ranking_eligible": false,
    "rationale": "Frozen diagnostic-only family; no unique production answer is registered.",
    "tier": "Silver"
  },
  "revision": 1,
  "risk": {
    "level": "medium",
    "loss_class": "operational",
    "rationale": "Frozen PER-26 risk assignment for FKW-14; errors may affect operations decisions."
  },
  "source": {
    "license": {
      "name": "Apache-2.0 dataset card; no composite row redistributed",
      "redistributable": true,
      "url": "https://www.apache.org/licenses/LICENSE-2.0"
    },
    "name": "BizBench structural seed (task structure only; facts re-authored from WDI)",
    "origin_type": "public_benchmark",
    "uri": "https://huggingface.co/datasets/kensho/bizbench"
  },
  "status": "frozen",
  "task": {
    "domain": "operations",
    "initial_state": {
      "simulated_ledger": null
    },
    "inputs": {
      "force_abstain_reason": "OCR_AMBIGUITY",
      "ocr_confidence": "0.40",
      "operation": "direct",
      "target_year": "2023"
    },
    "permissions": [
      "public_data_read"
    ],
    "prompt": "Extract a value only when OCR quality supports a unique reading; otherwise abstain.",
    "required_tools": [
      "snapshot.read"
    ]
  },
  "temporal": {
    "as_of": "2026-08-11T02:00:00Z",
    "available_at_cutoff": "2026-08-11T02:00:00Z",
    "event_time": "2023-12-31T23:59:59Z"
  },
  "variant": {
    "changed_factors": [
      "/task/inputs/ocr_confidence"
    ],
    "family_id": "FKW-14",
    "kind": "single_factor_perturbation",
    "parent_case_id": "case-public-fkw-14-normal-v1"
  }
}
