{
  "case_id": "case-public-fkw-04-single-factor-perturbation-v1",
  "contract_type": "case_card",
  "contract_version": "1.0.0",
  "evidence_policy": {
    "future_information_prohibited": true,
    "minimum_evidence_count": 1,
    "required_evidence_types": [
      "wdi_indicator_observation"
    ]
  },
  "evidence_refs": [
    {
      "evidence_type": "wdi_indicator_observation",
      "record_ids": [
        "FKW-04-DEU-2021",
        "FKW-04-DEU-2022",
        "FKW-04-DEU-2023"
      ],
      "snapshot_id": "snapshot-public-fkw-04-wdi-2021-2023-v1",
      "snapshot_sha256": "4030cf68815a2722fb0e227c1b807a7d96026f1e008b485af7011e2fcd34c65f"
    }
  ],
  "financial_subject": {
    "currency": {
      "code": "USD"
    },
    "entity_name": "DEU — GDP (current US$)",
    "identifiers": [
      {
        "scheme": "WB_COUNTRY",
        "value": "DEU"
      },
      {
        "scheme": "WB_INDICATOR",
        "value": "NY.GDP.MKTP.CD"
      }
    ],
    "market": {
      "country": "DEU",
      "mic": "XXXX",
      "timezone": "UTC"
    },
    "subject_type": "macro_series",
    "units": {
      "accounting_basis": "World Development Indicators; indicator-specific unit is preserved in each record",
      "amount_scale": "unit",
      "price_basis": "not_applicable"
    }
  },
  "integrity": {
    "canonicalization": "financial-agent-c14n-json-v1",
    "content_sha256": "db731ab271e7fad4362e02a0e0ac0a7629206398a6df57c448a00f58cd0cb6d1",
    "hash_algorithm": "sha256"
  },
  "lineage": {
    "code_revision": "2f0751ef1865b2617913bbcac414392e759945bec0fec01604a8bf8d349177de",
    "generated_at": "2026-08-11T02:00:00Z",
    "generator_version": "1.0.0",
    "parent_case_id": "case-public-fkw-04-normal-v1",
    "producer": "cases/public/build_public_cases.py",
    "source_case_id": "case-public-fkw-04-normal-v1"
  },
  "oracle": {
    "expected_status": "answer",
    "expected_value": {
      "basis": "prior_year_index_100",
      "value": "108.597571"
    },
    "implementation": "cases/public/oracle.py:evaluate",
    "implementation_sha256": "9097915075c71bf6344cfadbe0486c508259dd5de8dd47d6c325fccde169858d",
    "reason_codes": [],
    "spec_version": "1.0.0"
  },
  "quality": {
    "independently_recomputable": true,
    "ranking_eligible": true,
    "rationale": "Primary WDI observations and two independent deterministic implementations agree.",
    "tier": "Gold"
  },
  "revision": 1,
  "risk": {
    "level": "high",
    "loss_class": "financial",
    "rationale": "Frozen PER-26 risk assignment for FKW-04; errors may affect valuation decisions."
  },
  "source": {
    "license": {
      "name": "CC-BY-4.0 dataset; MIT code",
      "redistributable": true,
      "url": "https://creativecommons.org/licenses/by/4.0/"
    },
    "name": "FinQA structural seed (task structure only; facts re-authored from WDI)",
    "origin_type": "public_benchmark",
    "uri": "https://github.com/czyssrs/FinQA"
  },
  "status": "frozen",
  "task": {
    "domain": "valuation",
    "initial_state": {
      "simulated_ledger": null
    },
    "inputs": {
      "accounting_basis": "prior_year_index_100",
      "base_year": "2022",
      "operation": "basis",
      "target_year": "2023"
    },
    "permissions": [
      "public_data_read"
    ],
    "prompt": "Apply the registered calculation basis to the frozen observations and return the deterministic result.",
    "required_tools": [
      "snapshot.read"
    ]
  },
  "temporal": {
    "as_of": "2026-08-11T02:00:00Z",
    "available_at_cutoff": "2026-08-11T02:00:00Z",
    "event_time": "2023-12-31T23:59:59Z"
  },
  "variant": {
    "changed_factors": [
      "/task/inputs/accounting_basis"
    ],
    "family_id": "FKW-04",
    "kind": "single_factor_perturbation",
    "parent_case_id": "case-public-fkw-04-normal-v1"
  }
}
