{
  "case_id": "case-public-fkw-01-missing-or-anomalous-v1",
  "contract_type": "case_card",
  "contract_version": "1.0.0",
  "evidence_policy": {
    "future_information_prohibited": true,
    "minimum_evidence_count": 0,
    "required_evidence_types": []
  },
  "evidence_refs": [],
  "financial_subject": {
    "currency": {
      "code": "USD"
    },
    "entity_name": "USA — GDP (current US$)",
    "identifiers": [
      {
        "scheme": "WB_COUNTRY",
        "value": "USA"
      },
      {
        "scheme": "WB_INDICATOR",
        "value": "NY.GDP.MKTP.CD"
      }
    ],
    "market": {
      "country": "USA",
      "mic": "XXXX",
      "timezone": "UTC"
    },
    "subject_type": "macro_series",
    "units": {
      "accounting_basis": "World Development Indicators; indicator-specific unit is preserved in each record",
      "amount_scale": "unit",
      "price_basis": "not_applicable"
    }
  },
  "integrity": {
    "canonicalization": "financial-agent-c14n-json-v1",
    "content_sha256": "6c455e99574c51bab7f8a787fb71661fd2561073a16b1f1ab3c18a748ee88192",
    "hash_algorithm": "sha256"
  },
  "lineage": {
    "code_revision": "2f0751ef1865b2617913bbcac414392e759945bec0fec01604a8bf8d349177de",
    "generated_at": "2026-08-11T02:00:00Z",
    "generator_version": "1.0.0",
    "parent_case_id": "case-public-fkw-01-normal-v1",
    "producer": "cases/public/build_public_cases.py",
    "source_case_id": "case-public-fkw-01-normal-v1"
  },
  "oracle": {
    "expected_status": "abstain",
    "expected_value": null,
    "implementation": "cases/public/oracle.py:evaluate",
    "implementation_sha256": "9097915075c71bf6344cfadbe0486c508259dd5de8dd47d6c325fccde169858d",
    "reason_codes": [
      "INSUFFICIENT_EVIDENCE"
    ],
    "spec_version": "1.0.0"
  },
  "quality": {
    "independently_recomputable": false,
    "ranking_eligible": false,
    "rationale": "Required evidence is intentionally missing; only abstention is verifiable.",
    "tier": "Silver"
  },
  "revision": 1,
  "risk": {
    "level": "medium",
    "loss_class": "informational",
    "rationale": "Frozen PER-26 risk assignment for FKW-01; errors may affect research decisions."
  },
  "source": {
    "license": {
      "name": "CC-BY-NC-4.0",
      "redistributable": false,
      "url": "https://creativecommons.org/licenses/by-nc/4.0/"
    },
    "name": "FinanceBench structural seed (task structure only; facts re-authored from WDI)",
    "origin_type": "public_benchmark",
    "uri": "https://huggingface.co/datasets/PatronusAI/financebench"
  },
  "status": "frozen",
  "task": {
    "domain": "research",
    "initial_state": {
      "simulated_ledger": null
    },
    "inputs": {
      "operation": "direct",
      "target_year": "2023"
    },
    "permissions": [
      "public_data_read"
    ],
    "prompt": "Using only the frozen public-data snapshot available by the cutoff, report the registered year's value.",
    "required_tools": [
      "snapshot.read"
    ]
  },
  "temporal": {
    "as_of": "2026-08-11T02:00:00Z",
    "available_at_cutoff": "2026-08-11T02:00:00Z",
    "event_time": "2023-12-31T23:59:59Z"
  },
  "variant": {
    "changed_factors": [
      "/evidence_refs"
    ],
    "family_id": "FKW-01",
    "kind": "missing_or_anomalous",
    "parent_case_id": "case-public-fkw-01-normal-v1"
  }
}
