{
  "case_id": "case-public-fkw-12-single-factor-perturbation-v2",
  "contract_type": "case_card",
  "contract_version": "1.0.0",
  "evidence_policy": {
    "future_information_prohibited": true,
    "minimum_evidence_count": 1,
    "required_evidence_types": [
      "wdi_indicator_observation"
    ]
  },
  "evidence_refs": [
    {
      "evidence_type": "wdi_indicator_observation",
      "record_ids": [
        "FKW-12-MEX-2021",
        "FKW-12-MEX-2022",
        "FKW-12-MEX-2023"
      ],
      "snapshot_id": "snapshot-public-fkw-12-wdi-2021-2023-v2",
      "snapshot_sha256": "a1848b553fb1073e364dcc08690d9797c43db411a981099f5a70da860edcf767"
    }
  ],
  "financial_subject": {
    "currency": {
      "code": "USD"
    },
    "entity_name": "MEX — Exports of goods and services (% of GDP)",
    "identifiers": [
      {
        "scheme": "WB_COUNTRY",
        "value": "MEX"
      },
      {
        "scheme": "WB_INDICATOR",
        "value": "NE.EXP.GNFS.ZS"
      }
    ],
    "market": {
      "country": "MEX",
      "mic": "XXXX",
      "timezone": "UTC"
    },
    "subject_type": "macro_series",
    "units": {
      "accounting_basis": "World Development Indicators; indicator-specific unit is preserved in each record",
      "amount_scale": "unit",
      "price_basis": "not_applicable"
    }
  },
  "integrity": {
    "canonicalization": "financial-agent-c14n-json-v1",
    "content_sha256": "1727212b383299eefee0b5b241b8eed4fe5b781d0ab952f9cec205d7b982ffdd",
    "hash_algorithm": "sha256"
  },
  "lineage": {
    "code_revision": "1893b4cdccd30729ba6820aa485f5542038c03c470097b1cbcd60cdf9c8370f9",
    "generated_at": "2026-08-11T00:24:17.510180Z",
    "generator_version": "2.0.0",
    "parent_case_id": "case-public-fkw-12-normal-v2",
    "producer": "cases/public/v2/build_public_cases_v2.py",
    "source_case_id": "case-public-fkw-12-normal-v2"
  },
  "oracle": {
    "expected_status": "answer",
    "expected_value": {
      "meets_threshold": true,
      "threshold": "35",
      "value": "36.147934"
    },
    "implementation": "cases/public/oracle.py:evaluate",
    "implementation_sha256": "9097915075c71bf6344cfadbe0486c508259dd5de8dd47d6c325fccde169858d",
    "reason_codes": [],
    "spec_version": "1.0.0"
  },
  "quality": {
    "independently_recomputable": true,
    "ranking_eligible": true,
    "rationale": "Primary WDI observations and two independent deterministic implementations agree.",
    "tier": "Gold"
  },
  "revision": 2,
  "risk": {
    "level": "high",
    "loss_class": "financial",
    "rationale": "Frozen PER-26 risk assignment for FKW-12; errors may affect portfolio decisions."
  },
  "source": {
    "license": {
      "name": "Apache-2.0 dataset card",
      "redistributable": true,
      "url": "https://huggingface.co/datasets/kensho/bizbench/blob/0a793f2f886156902c72b4a22cab82bb9dceaecf/README.md"
    },
    "name": "BizBench structural seed (structure only; facts re-authored from WDI)",
    "origin_type": "public_benchmark",
    "uri": "https://huggingface.co/datasets/kensho/bizbench"
  },
  "status": "frozen",
  "task": {
    "domain": "portfolio",
    "initial_state": {
      "simulated_ledger": null
    },
    "inputs": {
      "operation": "threshold",
      "target_year": "2023",
      "threshold": "35"
    },
    "permissions": [
      "public_data_read"
    ],
    "prompt": "Compare the frozen portfolio proxy with the registered materiality threshold.",
    "required_tools": [
      "snapshot.read"
    ]
  },
  "temporal": {
    "as_of": "2026-08-11T00:24:16.703123Z",
    "available_at_cutoff": "2026-08-11T00:24:16.703123Z",
    "event_time": "2023-12-31T23:59:59Z"
  },
  "variant": {
    "changed_factors": [
      "/task/inputs/threshold"
    ],
    "family_id": "FKW-12",
    "kind": "single_factor_perturbation",
    "parent_case_id": "case-public-fkw-12-normal-v2"
  }
}
