{
  "case_id": "case-public-fkw-08-normal-v2",
  "contract_type": "case_card",
  "contract_version": "1.0.0",
  "evidence_policy": {
    "future_information_prohibited": true,
    "minimum_evidence_count": 1,
    "required_evidence_types": [
      "wdi_indicator_observation"
    ]
  },
  "evidence_refs": [
    {
      "evidence_type": "wdi_indicator_observation",
      "record_ids": [
        "FKW-08-AUS-2021",
        "FKW-08-AUS-2022",
        "FKW-08-AUS-2023"
      ],
      "snapshot_id": "snapshot-public-fkw-08-wdi-2021-2023-v2",
      "snapshot_sha256": "181c15f2b767f5e75f5a4029bd80c265199ade485641e1c8cb3c0c4aad14f7b1"
    }
  ],
  "financial_subject": {
    "currency": {
      "code": "USD"
    },
    "entity_name": "AUS — Trade (% of GDP)",
    "identifiers": [
      {
        "scheme": "WB_COUNTRY",
        "value": "AUS"
      },
      {
        "scheme": "WB_INDICATOR",
        "value": "NE.TRD.GNFS.ZS"
      }
    ],
    "market": {
      "country": "AUS",
      "mic": "XXXX",
      "timezone": "UTC"
    },
    "subject_type": "macro_series",
    "units": {
      "accounting_basis": "World Development Indicators; indicator-specific unit is preserved in each record",
      "amount_scale": "unit",
      "price_basis": "not_applicable"
    }
  },
  "integrity": {
    "canonicalization": "financial-agent-c14n-json-v1",
    "content_sha256": "fc691ff1d7916127624107caa1b56bfeff6fae4a3c5fc6b99e9189524a909338",
    "hash_algorithm": "sha256"
  },
  "lineage": {
    "code_revision": "1893b4cdccd30729ba6820aa485f5542038c03c470097b1cbcd60cdf9c8370f9",
    "generated_at": "2026-08-11T00:24:17.510180Z",
    "generator_version": "2.0.0",
    "parent_case_id": null,
    "producer": "cases/public/v2/build_public_cases_v2.py",
    "source_case_id": null
  },
  "oracle": {
    "expected_status": "answer",
    "expected_value": {
      "adjusted_change_pct": "7.330613",
      "regime": "stable"
    },
    "implementation": "cases/public/oracle.py:evaluate",
    "implementation_sha256": "9097915075c71bf6344cfadbe0486c508259dd5de8dd47d6c325fccde169858d",
    "reason_codes": [],
    "spec_version": "1.0.0"
  },
  "quality": {
    "independently_recomputable": true,
    "ranking_eligible": true,
    "rationale": "Primary WDI observations and two independent deterministic implementations agree.",
    "tier": "Gold"
  },
  "revision": 2,
  "risk": {
    "level": "high",
    "loss_class": "financial",
    "rationale": "Frozen PER-26 risk assignment for FKW-08; errors may affect risk decisions."
  },
  "source": {
    "license": {
      "name": "CC-BY-4.0 dataset; MIT code",
      "redistributable": true,
      "url": "https://github.com/NExTplusplus/TAT-QA/blob/870accc41953dcde885aabeb963d94aabdc0fbc3/README.md#license"
    },
    "name": "TAT-QA structural seed (structure only; facts re-authored from WDI)",
    "origin_type": "public_benchmark",
    "uri": "https://github.com/NExTplusplus/TAT-QA"
  },
  "status": "frozen",
  "task": {
    "domain": "risk",
    "initial_state": {
      "simulated_ledger": null
    },
    "inputs": {
      "event_regime": "stable",
      "operation": "regime",
      "regime_multiplier": "1.0"
    },
    "permissions": [
      "public_data_read"
    ],
    "prompt": "Compute the latest change and apply only the registered event-regime multiplier.",
    "required_tools": [
      "snapshot.read"
    ]
  },
  "temporal": {
    "as_of": "2026-08-11T00:24:14.443378Z",
    "available_at_cutoff": "2026-08-11T00:24:14.443378Z",
    "event_time": "2023-12-31T23:59:59Z"
  },
  "variant": {
    "changed_factors": [],
    "family_id": "FKW-08",
    "kind": "normal",
    "parent_case_id": null
  }
}
