{
  "case_id": "case-public-fkw-03-normal-v2",
  "contract_type": "case_card",
  "contract_version": "1.0.0",
  "evidence_policy": {
    "future_information_prohibited": true,
    "minimum_evidence_count": 1,
    "required_evidence_types": [
      "wdi_indicator_observation"
    ]
  },
  "evidence_refs": [
    {
      "evidence_type": "wdi_indicator_observation",
      "record_ids": [
        "FKW-03-JPN-2021",
        "FKW-03-JPN-2022",
        "FKW-03-JPN-2023"
      ],
      "snapshot_id": "snapshot-public-fkw-03-wdi-2021-2023-v2",
      "snapshot_sha256": "cbe300b59b4578e9eddc1e2a1d87154e684bd725ce95869e4189ff67dcd00bbb"
    }
  ],
  "financial_subject": {
    "currency": {
      "code": "USD"
    },
    "entity_name": "JPN — GDP per capita (current US$)",
    "identifiers": [
      {
        "scheme": "WB_COUNTRY",
        "value": "JPN"
      },
      {
        "scheme": "WB_INDICATOR",
        "value": "NY.GDP.PCAP.CD"
      }
    ],
    "market": {
      "country": "JPN",
      "mic": "XXXX",
      "timezone": "UTC"
    },
    "subject_type": "macro_series",
    "units": {
      "accounting_basis": "World Development Indicators; indicator-specific unit is preserved in each record",
      "amount_scale": "unit",
      "price_basis": "not_applicable"
    }
  },
  "integrity": {
    "canonicalization": "financial-agent-c14n-json-v1",
    "content_sha256": "8a230a692d4b9b4bff17fefab8112c4622ab2d5561ec682cb063ad2c9a568c58",
    "hash_algorithm": "sha256"
  },
  "lineage": {
    "code_revision": "1893b4cdccd30729ba6820aa485f5542038c03c470097b1cbcd60cdf9c8370f9",
    "generated_at": "2026-08-11T00:24:17.510180Z",
    "generator_version": "2.0.0",
    "parent_case_id": null,
    "producer": "cases/public/v2/build_public_cases_v2.py",
    "source_case_id": null
  },
  "oracle": {
    "expected_status": "answer",
    "expected_value": {
      "divisor": "1000000",
      "scaled_value": "0.035215"
    },
    "implementation": "cases/public/oracle.py:evaluate",
    "implementation_sha256": "9097915075c71bf6344cfadbe0486c508259dd5de8dd47d6c325fccde169858d",
    "reason_codes": [],
    "spec_version": "1.0.0"
  },
  "quality": {
    "independently_recomputable": true,
    "ranking_eligible": true,
    "rationale": "Primary WDI observations and two independent deterministic implementations agree.",
    "tier": "Gold"
  },
  "revision": 2,
  "risk": {
    "level": "high",
    "loss_class": "financial",
    "rationale": "Frozen PER-26 risk assignment for FKW-03; errors may affect valuation decisions."
  },
  "source": {
    "license": {
      "name": "CC-BY-NC-4.0",
      "redistributable": false,
      "url": "https://huggingface.co/datasets/PatronusAI/financebench/blob/e04404e3a97f69f79c14d42f24981a1c9c3bcd18/README.md"
    },
    "name": "FinanceBench structural seed (structure only; facts re-authored from WDI)",
    "origin_type": "public_benchmark",
    "uri": "https://huggingface.co/datasets/PatronusAI/financebench"
  },
  "status": "frozen",
  "task": {
    "domain": "valuation",
    "initial_state": {
      "simulated_ledger": null
    },
    "inputs": {
      "divisor": "1000000",
      "operation": "scale",
      "target_year": "2023"
    },
    "permissions": [
      "public_data_read"
    ],
    "prompt": "Convert the frozen value using the registered divisor; preserve the source currency and unit basis.",
    "required_tools": [
      "snapshot.read"
    ]
  },
  "temporal": {
    "as_of": "2026-08-11T00:24:13.478080Z",
    "available_at_cutoff": "2026-08-11T00:24:13.478080Z",
    "event_time": "2023-12-31T23:59:59Z"
  },
  "variant": {
    "changed_factors": [],
    "family_id": "FKW-03",
    "kind": "normal",
    "parent_case_id": null
  }
}
