{
  "case_id": "case-public-fkw-09-normal-v1",
  "contract_type": "case_card",
  "contract_version": "1.0.0",
  "evidence_policy": {
    "future_information_prohibited": true,
    "minimum_evidence_count": 1,
    "required_evidence_types": [
      "wdi_indicator_observation"
    ]
  },
  "evidence_refs": [
    {
      "evidence_type": "wdi_indicator_observation",
      "record_ids": [
        "FKW-09-IND-2021",
        "FKW-09-IND-2022",
        "FKW-09-IND-2023"
      ],
      "snapshot_id": "snapshot-public-fkw-09-wdi-2021-2023-v1",
      "snapshot_sha256": "d2ae3c6c8c819385ed6bea4388cae21754ff578a111b0c8a8cbe69737c8a0926"
    }
  ],
  "financial_subject": {
    "currency": {
      "code": "USD"
    },
    "entity_name": "IND — GDP (current US$)",
    "identifiers": [
      {
        "scheme": "WB_COUNTRY",
        "value": "IND"
      },
      {
        "scheme": "WB_INDICATOR",
        "value": "NY.GDP.MKTP.CD"
      }
    ],
    "market": {
      "country": "IND",
      "mic": "XXXX",
      "timezone": "UTC"
    },
    "subject_type": "macro_series",
    "units": {
      "accounting_basis": "World Development Indicators; indicator-specific unit is preserved in each record",
      "amount_scale": "unit",
      "price_basis": "not_applicable"
    }
  },
  "integrity": {
    "canonicalization": "financial-agent-c14n-json-v1",
    "content_sha256": "c12aaf5d6d87220eb3d275a9d47fd689aa311995b3eb5084b0bec125768baf9b",
    "hash_algorithm": "sha256"
  },
  "lineage": {
    "code_revision": "2f0751ef1865b2617913bbcac414392e759945bec0fec01604a8bf8d349177de",
    "generated_at": "2026-08-11T02:00:00Z",
    "generator_version": "1.0.0",
    "parent_case_id": null,
    "producer": "cases/public/build_public_cases.py",
    "source_case_id": null
  },
  "oracle": {
    "expected_status": "abstain",
    "expected_value": null,
    "implementation": "cases/public/oracle.py:evaluate",
    "implementation_sha256": "9097915075c71bf6344cfadbe0486c508259dd5de8dd47d6c325fccde169858d",
    "reason_codes": [
      "REVISION_HISTORY_UNAVAILABLE"
    ],
    "spec_version": "1.0.0"
  },
  "quality": {
    "independently_recomputable": false,
    "ranking_eligible": false,
    "rationale": "The WDI response exposes the current release but not immutable observation-level revision history.",
    "tier": "Silver"
  },
  "revision": 1,
  "risk": {
    "level": "high",
    "loss_class": "informational",
    "rationale": "Frozen PER-26 risk assignment for FKW-09; errors may affect research decisions."
  },
  "source": {
    "license": {
      "name": "CC-BY-4.0 dataset; MIT code",
      "redistributable": true,
      "url": "https://creativecommons.org/licenses/by/4.0/"
    },
    "name": "TAT-QA structural seed (task structure only; facts re-authored from WDI)",
    "origin_type": "public_benchmark",
    "uri": "https://github.com/NExTplusplus/TAT-QA"
  },
  "status": "frozen",
  "task": {
    "domain": "research",
    "initial_state": {
      "simulated_ledger": null
    },
    "inputs": {
      "force_abstain_reason": "REVISION_HISTORY_UNAVAILABLE",
      "operation": "direct",
      "revision_selector": "original",
      "target_year": "2023"
    },
    "permissions": [
      "public_data_read"
    ],
    "prompt": "Reconcile the requested source revision; abstain if an immutable revision history is not present.",
    "required_tools": [
      "snapshot.read"
    ]
  },
  "temporal": {
    "as_of": "2026-08-11T02:00:00Z",
    "available_at_cutoff": "2026-08-11T02:00:00Z",
    "event_time": "2023-12-31T23:59:59Z"
  },
  "variant": {
    "changed_factors": [],
    "family_id": "FKW-09",
    "kind": "normal",
    "parent_case_id": null
  }
}
